{
	"schemaVersion": 1,
	"project": "cinagroup",
	"root": ".",
	"source": {
		"repository": "https://github.com/cinagroup/cinagroup",
		"commit": "79b14e23f4af694b7d222c98a63d1d09f7dc397c"
	},
	"verification": "configured-pending-validation",
	"notes": [
		"Astro root website uses its existing npm package-lock; Node >=22 is required.",
		"Preserve content, i18n, factual evidence and Pages Functions gates.",
		"Production releases remain exclusively in GitHub Actions; manual workflows validate only.",
		"No deploy task is declared. Check and build write local Astro/Functions artifacts."
	],
	"components": [
		{
			"component": "website",
			"root": ".",
			"toolchain": {
				"name": "npm",
				"version": null,
				"lockfile": "package-lock.json"
			},
			"credentialRefs": [],
			"tasks": [
				{
					"task": "quality",
					"capability": "check",
					"argv": ["npm", "run", "check"],
					"cwd": ".",
					"dependencies": [],
					"outputs": [".astro", ".cina-cache/npm"],
					"effects": ["local-write"],
					"timeoutMs": 600000,
					"script": "npm run check:astro && npm run check:eslint && npm run check:prettier"
				},
				{
					"task": "source-gates",
					"capability": "check",
					"argv": ["npm", "run", "audit:source"],
					"cwd": ".",
					"dependencies": [],
					"outputs": [".cina-cache/npm"],
					"effects": ["local-write"],
					"timeoutMs": 120000,
					"script": "npm run audit:blog:source && npm run audit:content:source && npm run audit:fact-checks:source && npm run audit:evidence:source && npm run audit:i18n"
				},
				{
					"task": "functions",
					"capability": "check",
					"argv": ["npm", "run", "check:cloudflare"],
					"cwd": ".",
					"dependencies": [],
					"outputs": [".wrangler/functions-build", ".cina-cache/npm"],
					"effects": ["local-write"],
					"timeoutMs": 120000,
					"script": "wrangler types worker-configuration.d.ts --env-interface CloudflareEnv --include-runtime false --check && tsc -p functions/tsconfig.json --noEmit && wrangler pages functions build --outdir .wrangler/functions-build"
				},
				{
					"task": "build",
					"capability": "build",
					"argv": ["npm", "run", "build"],
					"cwd": ".",
					"dependencies": [],
					"outputs": ["dist", ".astro", ".cina-cache/npm"],
					"effects": ["local-write"],
					"timeoutMs": 600000,
					"script": "node scripts/clean-dist.mjs && astro build"
				},
				{
					"task": "build-gates",
					"capability": "build",
					"argv": ["npm", "run", "audit:build"],
					"cwd": ".",
					"dependencies": ["website/build"],
					"outputs": [".cina-cache/npm"],
					"effects": ["local-write"],
					"timeoutMs": 120000,
					"script": "node scripts/audit-build.mjs"
				},
				{
					"task": "contact",
					"capability": "test",
					"argv": ["npm", "run", "test:contact"],
					"cwd": ".",
					"dependencies": [],
					"outputs": [".cina-cache/npm"],
					"effects": ["local-write"],
					"timeoutMs": 120000,
					"script": "node --test tests/contact-core.test.mjs"
				},
				{
					"task": "blog-i18n",
					"capability": "test",
					"argv": ["npm", "run", "test:blog-i18n"],
					"cwd": ".",
					"dependencies": [],
					"outputs": [".cina-cache/npm"],
					"effects": ["local-write"],
					"timeoutMs": 120000,
					"script": "node --experimental-strip-types --test tests/blog-i18n.test.mjs"
				}
			]
		}
	]
}
